{
  "$schema": "https://json-schema.org/draft/2020-12/schema",
  "$id": "https://raw.githubusercontent.com/WENSHAO521/posi-data/master/schema/journal.schema.json",
  "title": "POSI Journal Record",
  "type": "object",
  "required": ["id", "title", "status", "identifiers", "provenance", "updated_at"],
  "additionalProperties": false,
  "properties": {
    "id": {
      "type": "string",
      "pattern": "^POSI-J-[0-9]{6,}$",
      "description": "Stable POSI journal identifier. Never reused, even if a journal is later removed from the Core Collection."
    },
    "title": { "type": "string", "description": "Title as registered with the ISSN Portal." },
    "short_title": { "type": ["string", "null"] },
    "alternate_titles": {
      "type": "array",
      "description": "Other titles the journal is known by. Kept searchable; never used as the display title. Each is a plain title, or an object saying what kind of title it is.",
      "items": {
        "oneOf": [
          { "type": "string", "minLength": 1 },
          {
            "type": "object",
            "required": ["title", "type"],
            "additionalProperties": false,
            "properties": {
              "title": { "type": "string", "minLength": 1 },
              "type": {
                "type": "string",
                "enum": ["former", "translation", "abbreviation", "variant"],
                "description": "former = the journal's title before a rename (see until). translation = the title in another language (see lang). abbreviation = a short form. variant = another form of the current title, e.g. as registered with Crossref/OpenAlex."
              },
              "lang": { "type": "string", "pattern": "^[a-z]{2,3}(-[A-Za-z0-9]+)*$", "description": "BCP 47 language tag, for translations." },
              "until": { "type": "integer", "minimum": 1600, "maximum": 2100, "description": "Last year a former title was in use." }
            }
          }
        ]
      }
    },
    "status": {
      "type": "string",
      "enum": ["discovered", "indexed", "metric_eligible"],
      "description": "discovered = found, not reviewed. indexed = passed POSI Core Collection (PCC) admission review. metric_eligible = indexed AND has enough continuous coverage/citation history to receive PCI/rankings."
    },
    "publisher": { "type": ["string", "null"] },
    "country": { "type": ["string", "null"], "description": "ISO 3166-1 alpha-2, publisher's registered country." },
    "language": { "type": ["array", "null"], "items": { "type": "string" }, "description": "BCP 47 language tags." },
    "open_access": { "type": ["boolean", "null"] },
    "license": { "type": ["string", "null"], "description": "SPDX-style license identifier for the journal's own content, e.g. CC-BY-4.0." },
    "website_url": { "type": ["string", "null"], "format": "uri" },

    "identifiers": {
      "type": "object",
      "additionalProperties": false,
      "properties": {
        "issn_l": { "type": ["string", "null"], "pattern": "^[0-9]{4}-[0-9]{3}[0-9X]$" },
        "issn_print": { "type": ["string", "null"], "pattern": "^[0-9]{4}-[0-9]{3}[0-9X]$" },
        "issn_online": { "type": ["string", "null"], "pattern": "^[0-9]{4}-[0-9]{3}[0-9X]$" },
        "openalex_source_id": { "type": ["string", "null"] },
        "crossref_member_id": { "type": ["string", "null"] },
        "ror_publisher_id": { "type": ["string", "null"] },
        "doaj_id": { "type": ["string", "null"] }
      }
    },

    "classification": {
      "type": ["object", "null"],
      "additionalProperties": false,
      "properties": {
        "primary": { "type": "string", "description": "PSC code, e.g. P3.03.04" },
        "secondary": { "type": "array", "items": { "type": "string" }, "maxItems": 2 },
        "psc_version": { "type": "string" },
        "psc_confidence": {
          "type": ["string", "null"],
          "enum": ["high", "medium", "low", "unclassified", "verified", null],
          "description": "PSC-CROSSWALK-0.2 (see CHANGELOG.md). Only 'high' or 'verified' may be used to build an E-Q/M-Q/Citation-Q peer cohort (posi-engine's src/cohort.mjs) — 'medium'/'low'/'unclassified' may still be displayed as a suggested category. 'verified' is assigned only by a human POSI Subject Editor sign-off, never computed by src/psc-classify.mjs itself. Nullable/omittable for records classified before PSC-CROSSWALK-0.2 shipped."
        },
        "assigned_by": { "type": "string", "enum": ["posi_subject_editor", "ml_suggested_pending_review"] },
        "assigned_at": { "type": "string", "format": "date" }
      },
      "required": ["primary", "psc_version"]
    },

    "coverage": {
      "type": ["object", "null"],
      "additionalProperties": false,
      "properties": {
        "indexed_since": { "type": ["string", "null"], "format": "date" },
        "metric_eligible_since": { "type": ["string", "null"], "format": "date" },
        "coverage_gaps": {
          "type": "array",
          "items": {
            "type": "object",
            "properties": {
              "from": { "type": "string", "format": "date" },
              "to": { "type": "string", "format": "date" },
              "reason": { "type": "string" }
            }
          }
        }
      }
    },

    "lifecycle": {
      "type": ["object", "null"],
      "description": "POSI Journal Evaluation & Ranking Framework 1.0's lifecycle section (posi-engine's src/lifecycle.mjs, src/first-publication-date.mjs). Additive/optional — a journal record with no `lifecycle` block has simply not been run through this pipeline stage yet, not an error.",
      "additionalProperties": false,
      "properties": {
        "first_regular_publication_date": { "type": ["string", "null"], "format": "date" },
        "first_publication_source": {
          "type": ["string", "null"],
          "enum": ["publisher_verified", "archive_verified", "crossref", "openalex", "other_archive", null]
        },
        "first_publication_evidence_id": { "type": ["string", "null"] },
        "first_publication_verified_at": { "type": ["string", "null"], "format": "date" },
        "lifecycle_stage": { "type": ["string", "null"], "enum": ["unknown", "observation", "early_stage", "mature", null] },
        "months_since_launch": { "type": ["integer", "null"], "description": "Diagnostic/display only — see src/lifecycle.mjs's module header for why this must never be used to decide lifecycle_stage itself." },
        "lifecycle_methodology_version": { "type": ["string", "null"] }
      }
    },

    "status_model": {
      "type": ["object", "null"],
      "description": "The framework's coverage-state model — six independent fields, deliberately NOT a replacement for the existing top-level `status` field (discovered/indexed/metric_eligible), which stays as-is to avoid breaking existing consumers. This is an additive, richer model layered alongside it; `status_model.collection_status` and the legacy `status` field are expected to be kept in sync by whichever pipeline stage writes both, but this schema does not enforce that itself.",
      "additionalProperties": false,
      "properties": {
        "collection_status": { "type": "string", "enum": ["discovered", "candidate", "core", "under_review", "suspended", "ceased", "withdrawn", "delisted", "archived"] },
        "coverage_state": { "type": "string", "enum": ["active", "inactive", "gap", "unknown"] },
        "lifecycle_stage": { "type": "string", "enum": ["unknown", "observation", "early_stage", "mature"] },
        "rating_status": { "type": "string", "enum": ["not_evaluated", "provisional", "rated", "blocked", "insufficient_evidence", "suppressed"] },
        "metric_status": { "type": "string", "enum": ["not_eligible", "eligible", "suppressed"] },
        "evidence_status": { "type": "string", "enum": ["complete", "partial", "blocked", "insufficient", "conflicted", "stale"] }
      }
    },

    "selection": {
      "type": ["object", "null"],
      "description": "POSI Core Collection admission decision — see posi-engine's Editorial Selection methodology.",
      "additionalProperties": false,
      "properties": {
        "decision": { "type": "string", "enum": ["accepted", "rejected", "pending"] },
        "methodology_version": { "type": "string" },
        "decided_at": { "type": ["string", "null"], "format": "date" },
        "reviewers_conflicted": {
          "type": "boolean",
          "description": "true if the journal's publisher has a relationship with Panorama Scholarly Group — triggers the independent-reviewer requirement."
        }
      }
    },

    "provenance": {
      "type": "array",
      "minItems": 1,
      "description": "One entry per upstream source that contributed to this record — a journal is typically assembled from several (e.g. title/publisher from Crossref, OA status from DOAJ, ROR affiliation from ROR). Order is not significant; field-level provenance is out of scope for v1.0 (see field_provenance below for the planned extension).",
      "items": {
        "type": "object",
        "required": ["source", "retrieved_at"],
        "additionalProperties": false,
        "properties": {
          "source": {
            "type": "string",
            "enum": ["crossref", "openalex", "opencitations", "datacite", "doaj", "ror", "publisher_direct", "posi_curation"]
          },
          "source_record_id": { "type": ["string", "null"] },
          "retrieved_at": { "type": "string", "format": "date-time" },
          "license": { "type": ["string", "null"], "description": "License of the upstream record itself, not POSI's derived data." }
        }
      }
    },
    "field_provenance": {
      "type": ["object", "null"],
      "description": "Planned extension, not required in v1.0: maps a field name to the source(s) it was taken from, e.g. {\"title\": [\"crossref\"], \"open_access\": [\"doaj\"]}. Omit until field-level tracking is implemented.",
      "additionalProperties": { "type": "array", "items": { "type": "string" } }
    },

    "created_at": { "type": "string", "format": "date-time" },
    "updated_at": { "type": "string", "format": "date-time" }
  }
}
