{
  "id": "POSI-J-000119",
  "title": "Frontiers in Genetics",
  "short_title": "Frontiers in Genetics",
  "status": "discovered",
  "publisher": "Frontiers Media",
  "country": "CH",
  "language": [
    "en"
  ],
  "open_access": true,
  "license": null,
  "website_url": "http://journal.frontiersin.org/journal/genetics",
  "identifiers": {
    "issn_l": "1664-8021",
    "issn_print": null,
    "issn_online": "1664-8021",
    "openalex_source_id": "S2597340651",
    "crossref_member_id": null,
    "ror_publisher_id": null,
    "doaj_id": null
  },
  "classification": null,
  "coverage": null,
  "selection": null,
  "provenance": [
    {
      "source": "posi_curation",
      "source_record_id": "j-bench-frontiers-in-genetics-0391",
      "retrieved_at": "2026-08-12T03:43:43.105Z",
      "license": null
    },
    {
      "source": "openalex",
      "source_record_id": "S2597340651",
      "retrieved_at": "2026-08-12T03:43:43.105Z",
      "license": "CC0-1.0"
    }
  ],
  "created_at": "2026-08-10T03:49:42.398Z",
  "updated_at": "2026-08-12T03:43:43.105Z"
}
