{
  "id": "POSI-J-023374",
  "title": "Electrochimica Acta",
  "short_title": "Electrochimica Acta",
  "status": "discovered",
  "publisher": "Elsevier BV",
  "country": "GB",
  "language": [
    "en"
  ],
  "open_access": false,
  "license": null,
  "website_url": "http://www.elsevier.com/wps/find/journaldescription.cws_home/205/description#description",
  "identifiers": {
    "issn_l": "0013-4686",
    "issn_print": null,
    "issn_online": "0013-4686",
    "openalex_source_id": "S198339081",
    "crossref_member_id": null,
    "ror_publisher_id": null,
    "doaj_id": null
  },
  "classification": null,
  "coverage": null,
  "selection": null,
  "provenance": [
    {
      "source": "posi_curation",
      "source_record_id": "j-bench-electrochimica-acta-0052",
      "retrieved_at": "2026-08-12T03:43:43.105Z",
      "license": null
    },
    {
      "source": "openalex",
      "source_record_id": "S198339081",
      "retrieved_at": "2026-08-12T03:43:43.105Z",
      "license": "CC0-1.0"
    }
  ],
  "created_at": "2026-08-10T03:49:42.390Z",
  "updated_at": "2026-08-12T03:43:43.105Z"
}
