{
  "id": "POSI-J-024188",
  "title": "Allergy",
  "short_title": "Allergy",
  "status": "discovered",
  "publisher": "Wiley",
  "country": "GB",
  "language": [
    "en"
  ],
  "open_access": false,
  "license": null,
  "website_url": "http://www.wiley.com/bw/journal.asp?ref=0105-4538",
  "identifiers": {
    "issn_l": "0105-4538",
    "issn_print": "0105-4538",
    "issn_online": "1398-9995",
    "openalex_source_id": "S68090385",
    "crossref_member_id": null,
    "ror_publisher_id": null,
    "doaj_id": null
  },
  "classification": null,
  "coverage": null,
  "selection": null,
  "provenance": [
    {
      "source": "posi_curation",
      "source_record_id": "j-bench-allergy-0981",
      "retrieved_at": "2026-08-12T03:43:43.105Z",
      "license": null
    },
    {
      "source": "openalex",
      "source_record_id": "S68090385",
      "retrieved_at": "2026-08-12T03:43:43.105Z",
      "license": "CC0-1.0"
    },
    {
      "source": "posi_curation",
      "source_record_id": "issn-regression-review-2026-10-17/review-135.csv",
      "retrieved_at": "2026-10-17T05:00:06.899Z",
      "license": null
    }
  ],
  "created_at": "2026-08-10T03:49:42.406Z",
  "updated_at": "2026-10-17T05:00:06.899Z"
}
