{
  "id": "POSI-J-023954",
  "title": "Town Planning Review",
  "short_title": "Town Planning Review",
  "status": "discovered",
  "publisher": "Liverpool University Press",
  "country": "GB",
  "language": [
    "en"
  ],
  "open_access": false,
  "license": null,
  "website_url": "http://liverpool.metapress.com/content/121633/?sortorder=asc&p_o=223",
  "identifiers": {
    "issn_l": "0041-0020",
    "issn_print": null,
    "issn_online": "0041-0020",
    "openalex_source_id": "S127305097",
    "crossref_member_id": null,
    "ror_publisher_id": null,
    "doaj_id": null
  },
  "classification": null,
  "coverage": null,
  "selection": null,
  "provenance": [
    {
      "source": "posi_curation",
      "source_record_id": "j-bench-town-planning-review-0721",
      "retrieved_at": "2026-08-12T03:43:43.105Z",
      "license": null
    },
    {
      "source": "openalex",
      "source_record_id": "S127305097",
      "retrieved_at": "2026-08-12T03:43:43.105Z",
      "license": "CC0-1.0"
    }
  ],
  "created_at": "2026-08-10T03:49:42.403Z",
  "updated_at": "2026-08-12T03:43:43.105Z"
}
