{
  "id": "POSI-J-023756",
  "title": "Environmental Science and Pollution Research",
  "short_title": "Environmental Science and Pollution R...",
  "status": "discovered",
  "publisher": "Springer Science+Business Media",
  "country": "DE",
  "language": [
    "en"
  ],
  "open_access": false,
  "license": null,
  "website_url": "https://www.springer.com/journal/11356",
  "identifiers": {
    "issn_l": "0944-1344",
    "issn_print": null,
    "issn_online": "0944-1344",
    "openalex_source_id": "S87561820",
    "crossref_member_id": null,
    "ror_publisher_id": null,
    "doaj_id": null
  },
  "classification": null,
  "coverage": null,
  "selection": null,
  "provenance": [
    {
      "source": "posi_curation",
      "source_record_id": "j-bench-environmental-science-and-pollution-rese-0508",
      "retrieved_at": "2026-08-12T03:43:43.105Z",
      "license": null
    },
    {
      "source": "openalex",
      "source_record_id": "S87561820",
      "retrieved_at": "2026-08-12T03:43:43.105Z",
      "license": "CC0-1.0"
    }
  ],
  "created_at": "2026-08-10T03:49:42.400Z",
  "updated_at": "2026-08-12T03:43:43.105Z"
}
