{
  "id": "POSI-J-023900",
  "title": "Journal of Marriage and the Family",
  "short_title": "Journal of Marriage and the Family",
  "status": "discovered",
  "publisher": "Wiley",
  "country": "GB",
  "language": [
    "en"
  ],
  "open_access": false,
  "license": null,
  "website_url": "http://onlinelibrary.wiley.com/journal/10.1111/(ISSN)1741-3737",
  "identifiers": {
    "issn_l": "0022-2445",
    "issn_print": "0022-2445",
    "issn_online": "1741-3737",
    "openalex_source_id": "S146344",
    "crossref_member_id": null,
    "ror_publisher_id": null,
    "doaj_id": null
  },
  "classification": null,
  "coverage": null,
  "selection": null,
  "provenance": [
    {
      "source": "posi_curation",
      "source_record_id": "j-bench-journal-of-marriage-and-the-family-0662",
      "retrieved_at": "2026-08-12T03:43:43.105Z",
      "license": null
    },
    {
      "source": "openalex",
      "source_record_id": "S146344",
      "retrieved_at": "2026-08-12T03:43:43.105Z",
      "license": "CC0-1.0"
    },
    {
      "source": "posi_curation",
      "source_record_id": "issn-regression-review-2026-10-17/review-135.csv",
      "retrieved_at": "2026-10-17T05:00:06.899Z",
      "license": null
    }
  ],
  "created_at": "2026-08-10T03:49:42.402Z",
  "updated_at": "2026-10-17T05:00:06.899Z"
}
