{
  "id": "POSI-J-023769",
  "title": "European Journal of Operational Research",
  "short_title": "European Journal of Operational Research",
  "status": "discovered",
  "publisher": "Elsevier BV",
  "country": "NL",
  "language": [
    "en"
  ],
  "open_access": false,
  "license": null,
  "website_url": "https://www.journals.elsevier.com/european-journal-of-operational-research",
  "identifiers": {
    "issn_l": "0377-2217",
    "issn_print": null,
    "issn_online": "0377-2217",
    "openalex_source_id": "S103321696",
    "crossref_member_id": null,
    "ror_publisher_id": null,
    "doaj_id": null
  },
  "classification": null,
  "coverage": null,
  "selection": null,
  "provenance": [
    {
      "source": "posi_curation",
      "source_record_id": "j-bench-european-journal-of-operational-research-0522",
      "retrieved_at": "2026-08-12T03:43:43.105Z",
      "license": null
    },
    {
      "source": "openalex",
      "source_record_id": "S103321696",
      "retrieved_at": "2026-08-12T03:43:43.105Z",
      "license": "CC0-1.0"
    }
  ],
  "created_at": "2026-08-10T03:49:42.400Z",
  "updated_at": "2026-08-12T03:43:43.105Z"
}
