{
  "id": "POSI-J-023626",
  "title": "Journal of Antimicrobial Chemotherapy",
  "short_title": "Journal of Antimicrobial Chemotherapy",
  "status": "discovered",
  "publisher": "Oxford University Press",
  "country": "GB",
  "language": [
    "en"
  ],
  "open_access": false,
  "license": null,
  "website_url": "http://jac.oxfordjournals.org",
  "identifiers": {
    "issn_l": "0305-7453",
    "issn_print": null,
    "issn_online": "0305-7453",
    "openalex_source_id": "S124275759",
    "crossref_member_id": null,
    "ror_publisher_id": null,
    "doaj_id": null
  },
  "classification": null,
  "coverage": null,
  "selection": null,
  "provenance": [
    {
      "source": "posi_curation",
      "source_record_id": "j-bench-journal-of-antimicrobial-chemotherapy-0343",
      "retrieved_at": "2026-08-12T03:43:43.105Z",
      "license": null
    },
    {
      "source": "openalex",
      "source_record_id": "S124275759",
      "retrieved_at": "2026-08-12T03:43:43.105Z",
      "license": "CC0-1.0"
    }
  ],
  "created_at": "2026-08-10T03:49:42.397Z",
  "updated_at": "2026-08-12T03:43:43.105Z"
}
