{
  "id": "POSI-J-000011",
  "title": "Journal of Social Cognition and Communication",
  "short_title": "JSCC",
  "status": "indexed",
  "publisher": "Panorama Scholarly Group",
  "country": "HK",
  "language": [
    "en"
  ],
  "open_access": true,
  "license": "CC-BY-4.0",
  "website_url": "https://journals.panorama-sg.com/jscc",
  "identifiers": {
    "issn_l": "3054-6958",
    "issn_print": null,
    "issn_online": "3054-6958",
    "openalex_source_id": "S7407056239",
    "crossref_member_id": null,
    "ror_publisher_id": null,
    "doaj_id": null
  },
  "classification": null,
  "coverage": null,
  "selection": null,
  "provenance": [
    {
      "source": "posi_curation",
      "source_record_id": "j-jscc",
      "retrieved_at": "2026-08-12T03:43:43.105Z",
      "license": null
    },
    {
      "source": "openalex",
      "source_record_id": "S7407056239",
      "retrieved_at": "2026-08-12T03:43:43.105Z",
      "license": "CC0-1.0"
    }
  ],
  "created_at": "2026-07-15T00:00:00Z",
  "updated_at": "2026-08-12T03:43:43.105Z"
}
