{
  "id": "POSI-J-023797",
  "title": "Industrial and Labor Relations Review",
  "short_title": "Industrial and Labor Relations Review",
  "status": "discovered",
  "publisher": "SAGE Publishing",
  "country": "US",
  "language": [
    "en"
  ],
  "open_access": false,
  "license": null,
  "website_url": "http://www.ilr.cornell.edu/ilrreview/",
  "identifiers": {
    "issn_l": "0019-7939",
    "issn_print": null,
    "issn_online": "0019-7939",
    "openalex_source_id": "S192274990",
    "crossref_member_id": null,
    "ror_publisher_id": null,
    "doaj_id": null
  },
  "classification": null,
  "coverage": null,
  "selection": null,
  "provenance": [
    {
      "source": "posi_curation",
      "source_record_id": "j-bench-industrial-and-labor-relations-review-0551",
      "retrieved_at": "2026-08-12T03:43:43.105Z",
      "license": null
    },
    {
      "source": "openalex",
      "source_record_id": "S192274990",
      "retrieved_at": "2026-08-12T03:43:43.105Z",
      "license": "CC0-1.0"
    }
  ],
  "created_at": "2026-08-10T03:49:42.400Z",
  "updated_at": "2026-08-12T03:43:43.105Z"
}
