{
  "id": "POSI-J-023473",
  "title": "IEEE Transactions on Instrumentation and Measurement",
  "short_title": "IEEE Transactions on Instrumentation ...",
  "status": "discovered",
  "publisher": "Institute of Electrical and Electronics Engineers",
  "country": "US",
  "language": [
    "en"
  ],
  "open_access": false,
  "license": null,
  "website_url": "http://ieeexplore.ieee.org/servlet/opac?punumber=19",
  "identifiers": {
    "issn_l": "0018-9456",
    "issn_print": null,
    "issn_online": "0018-9456",
    "openalex_source_id": "S10892749",
    "crossref_member_id": null,
    "ror_publisher_id": null,
    "doaj_id": null
  },
  "classification": null,
  "coverage": null,
  "selection": null,
  "provenance": [
    {
      "source": "posi_curation",
      "source_record_id": "j-bench-ieee-transactions-on-instrumentation-and-0159",
      "retrieved_at": "2026-08-12T03:43:43.105Z",
      "license": null
    },
    {
      "source": "openalex",
      "source_record_id": "S10892749",
      "retrieved_at": "2026-08-12T03:43:43.105Z",
      "license": "CC0-1.0"
    }
  ],
  "created_at": "2026-08-10T03:49:42.392Z",
  "updated_at": "2026-08-12T03:43:43.105Z"
}
