{
  "id": "POSI-J-023345",
  "title": "Physical Review A",
  "short_title": "Physical Review A",
  "status": "discovered",
  "publisher": "American Physical Society",
  "country": "US",
  "language": [
    "en"
  ],
  "open_access": false,
  "license": null,
  "website_url": "http://journals.aps.org/pra/",
  "identifiers": {
    "issn_l": "0556-2791",
    "issn_print": null,
    "issn_online": "0556-2791",
    "openalex_source_id": "S164566984",
    "crossref_member_id": null,
    "ror_publisher_id": null,
    "doaj_id": null
  },
  "classification": null,
  "coverage": null,
  "selection": null,
  "provenance": [
    {
      "source": "posi_curation",
      "source_record_id": "j-bench-physical-review-a-0014",
      "retrieved_at": "2026-08-12T03:43:43.105Z",
      "license": null
    },
    {
      "source": "openalex",
      "source_record_id": "S164566984",
      "retrieved_at": "2026-08-12T03:43:43.105Z",
      "license": "CC0-1.0"
    }
  ],
  "created_at": "2026-08-10T03:49:42.390Z",
  "updated_at": "2026-08-12T03:43:43.105Z"
}
