{
  "id": "POSI-J-023654",
  "title": "Psychopharmacology",
  "short_title": "Psychopharmacology",
  "status": "discovered",
  "publisher": "Springer Science+Business Media",
  "country": "DE",
  "language": [
    "en"
  ],
  "open_access": false,
  "license": null,
  "website_url": "http://www.springer.com/biomed/neuroscience/journal/213",
  "identifiers": {
    "issn_l": "0033-3158",
    "issn_print": null,
    "issn_online": "0033-3158",
    "openalex_source_id": "S80334769",
    "crossref_member_id": null,
    "ror_publisher_id": null,
    "doaj_id": null
  },
  "classification": null,
  "coverage": null,
  "selection": null,
  "provenance": [
    {
      "source": "posi_curation",
      "source_record_id": "j-bench-psychopharmacology-0381",
      "retrieved_at": "2026-08-12T03:43:43.105Z",
      "license": null
    },
    {
      "source": "openalex",
      "source_record_id": "S80334769",
      "retrieved_at": "2026-08-12T03:43:43.105Z",
      "license": "CC0-1.0"
    }
  ],
  "created_at": "2026-08-10T03:49:42.398Z",
  "updated_at": "2026-08-12T03:43:43.105Z"
}
