{
  "id": "POSI-J-023723",
  "title": "Molecular and Cellular Biochemistry",
  "short_title": "Molecular and Cellular Biochemistry",
  "status": "discovered",
  "publisher": "Springer Science+Business Media",
  "country": "NL",
  "language": [
    "en"
  ],
  "open_access": false,
  "license": null,
  "website_url": "http://www.springer.com/life+sciences/biochemistry+%26+biophysics/journal/11010",
  "identifiers": {
    "issn_l": "0300-8177",
    "issn_print": null,
    "issn_online": "0300-8177",
    "openalex_source_id": "S11742566",
    "crossref_member_id": null,
    "ror_publisher_id": null,
    "doaj_id": null
  },
  "classification": null,
  "coverage": null,
  "selection": null,
  "provenance": [
    {
      "source": "posi_curation",
      "source_record_id": "j-bench-molecular-and-cellular-biochemistry-0465",
      "retrieved_at": "2026-08-12T03:43:43.105Z",
      "license": null
    },
    {
      "source": "openalex",
      "source_record_id": "S11742566",
      "retrieved_at": "2026-08-12T03:43:43.105Z",
      "license": "CC0-1.0"
    }
  ],
  "created_at": "2026-08-10T03:49:42.399Z",
  "updated_at": "2026-08-12T03:43:43.105Z"
}
