{
  "id": "POSI-J-024193",
  "title": "American Journal of Orthodontics and Dentofacial Orthopedics",
  "short_title": "American Journal of Orthodontics and ...",
  "status": "discovered",
  "publisher": "Elsevier BV",
  "country": "US",
  "language": [
    "en"
  ],
  "open_access": false,
  "license": null,
  "website_url": "http://www.elsevier.com/wps/find/journaldescription.cws_home/623219/description#description",
  "identifiers": {
    "issn_l": "0889-5406",
    "issn_print": null,
    "issn_online": "0889-5406",
    "openalex_source_id": "S67147237",
    "crossref_member_id": null,
    "ror_publisher_id": null,
    "doaj_id": null
  },
  "classification": null,
  "coverage": null,
  "selection": null,
  "provenance": [
    {
      "source": "posi_curation",
      "source_record_id": "j-bench-american-journal-of-orthodontics-and-den-0986",
      "retrieved_at": "2026-08-12T03:43:43.105Z",
      "license": null
    },
    {
      "source": "openalex",
      "source_record_id": "S67147237",
      "retrieved_at": "2026-08-12T03:43:43.105Z",
      "license": "CC0-1.0"
    }
  ],
  "created_at": "2026-08-10T03:49:42.406Z",
  "updated_at": "2026-08-12T03:43:43.105Z"
}
