{
  "id": "POSI-J-024023",
  "title": "Journal of Thoracic and Cardiovascular Surgery",
  "short_title": "Journal of Thoracic and Cardiovascula...",
  "status": "discovered",
  "publisher": "Elsevier BV",
  "country": "US",
  "language": [
    "en"
  ],
  "open_access": false,
  "license": null,
  "website_url": "https://www.sciencedirect.com/journal/the-journal-of-thoracic-and-cardiovascular-surgery",
  "identifiers": {
    "issn_l": "0022-5223",
    "issn_print": null,
    "issn_online": "0022-5223",
    "openalex_source_id": "S127437062",
    "crossref_member_id": null,
    "ror_publisher_id": null,
    "doaj_id": null
  },
  "classification": null,
  "coverage": null,
  "selection": null,
  "provenance": [
    {
      "source": "posi_curation",
      "source_record_id": "j-bench-journal-of-thoracic-and-cardiovascular-s-0797",
      "retrieved_at": "2026-08-12T03:43:43.105Z",
      "license": null
    },
    {
      "source": "openalex",
      "source_record_id": "S127437062",
      "retrieved_at": "2026-08-12T03:43:43.105Z",
      "license": "CC0-1.0"
    }
  ],
  "created_at": "2026-08-10T03:49:42.404Z",
  "updated_at": "2026-08-12T03:43:43.105Z"
}
