{
  "id": "POSI-J-023830",
  "title": "American Journal of Orthopsychiatry",
  "short_title": "American Journal of Orthopsychiatry",
  "status": "discovered",
  "publisher": "American Psychological Association",
  "country": "US",
  "language": [
    "en"
  ],
  "open_access": false,
  "license": null,
  "website_url": "http://www.apa.org/pubs/journals/ort",
  "identifiers": {
    "issn_l": "0002-9432",
    "issn_print": null,
    "issn_online": "0002-9432",
    "openalex_source_id": "S84156235",
    "crossref_member_id": null,
    "ror_publisher_id": null,
    "doaj_id": null
  },
  "classification": null,
  "coverage": null,
  "selection": null,
  "provenance": [
    {
      "source": "posi_curation",
      "source_record_id": "j-bench-american-journal-of-orthopsychiatry-0584",
      "retrieved_at": "2026-08-12T03:43:43.105Z",
      "license": null
    },
    {
      "source": "openalex",
      "source_record_id": "S84156235",
      "retrieved_at": "2026-08-12T03:43:43.105Z",
      "license": "CC0-1.0"
    }
  ],
  "created_at": "2026-08-10T03:49:42.401Z",
  "updated_at": "2026-08-12T03:43:43.105Z"
}
